{
  "adapter_version": "cubeengine.alphazero-adapter/1.0",
  "adapter_id": "ai:tictactoe_3d",
  "revision": 0,
  "content_hash": "02595c79a54bb13593fafa70f9aa87a5e3ec8e472bdb8f50b9246720bf17953a",
  "metadata": {
    "name": "3D Tic-Tac-Toe AlphaZero Adapter",
    "description": "Reviewed 3D tensor and 24 proper cube rotations for the generic nine-API compiler."
  },
  "rule": {
    "document_id": "rule:game.tictactoe_3d",
    "content_hash": "28ccdf47faa1f662a283efbce4a0c29ff35d318d534e775a021879286db1141f",
    "mode_id": "rule:mode.default",
    "parameters": {}
  },
  "players": {
    "positive": "rule:participant.positive",
    "negative": "rule:participant.negative",
    "canonicalization": "swap_player_owned_values"
  },
  "tensor": {
    "topology": "rule:topology.board",
    "state": "rule:state.board_cell",
    "dtype": "int8",
    "value_map": [
      {"rule_value": 0, "tensor_value": 0, "owner": null},
      {"rule_value": 1, "tensor_value": 1, "owner": "positive"},
      {"rule_value": -1, "tensor_value": -1, "owner": "negative"}
    ]
  },
  "actions": {
    "catalogue": "rule_runtime_stable",
    "coordinate_parameter": "target",
    "forced_pass": false
  },
  "outcomes": {"draw_value": 0.0001, "draw_statuses": ["draw"]},
  "symmetries": [
    {"id": "r00", "axis_permutation": [0, 1, 2], "axis_reflections": [false, false, false]},
    {"id": "r01", "axis_permutation": [0, 1, 2], "axis_reflections": [true, true, false]},
    {"id": "r02", "axis_permutation": [0, 1, 2], "axis_reflections": [true, false, true]},
    {"id": "r03", "axis_permutation": [0, 1, 2], "axis_reflections": [false, true, true]},
    {"id": "r04", "axis_permutation": [0, 2, 1], "axis_reflections": [true, false, false]},
    {"id": "r05", "axis_permutation": [0, 2, 1], "axis_reflections": [false, true, false]},
    {"id": "r06", "axis_permutation": [0, 2, 1], "axis_reflections": [false, false, true]},
    {"id": "r07", "axis_permutation": [0, 2, 1], "axis_reflections": [true, true, true]},
    {"id": "r08", "axis_permutation": [1, 0, 2], "axis_reflections": [true, false, false]},
    {"id": "r09", "axis_permutation": [1, 0, 2], "axis_reflections": [false, true, false]},
    {"id": "r10", "axis_permutation": [1, 0, 2], "axis_reflections": [false, false, true]},
    {"id": "r11", "axis_permutation": [1, 0, 2], "axis_reflections": [true, true, true]},
    {"id": "r12", "axis_permutation": [1, 2, 0], "axis_reflections": [false, false, false]},
    {"id": "r13", "axis_permutation": [1, 2, 0], "axis_reflections": [true, true, false]},
    {"id": "r14", "axis_permutation": [1, 2, 0], "axis_reflections": [true, false, true]},
    {"id": "r15", "axis_permutation": [1, 2, 0], "axis_reflections": [false, true, true]},
    {"id": "r16", "axis_permutation": [2, 0, 1], "axis_reflections": [false, false, false]},
    {"id": "r17", "axis_permutation": [2, 0, 1], "axis_reflections": [true, true, false]},
    {"id": "r18", "axis_permutation": [2, 0, 1], "axis_reflections": [true, false, true]},
    {"id": "r19", "axis_permutation": [2, 0, 1], "axis_reflections": [false, true, true]},
    {"id": "r20", "axis_permutation": [2, 1, 0], "axis_reflections": [true, false, false]},
    {"id": "r21", "axis_permutation": [2, 1, 0], "axis_reflections": [false, true, false]},
    {"id": "r22", "axis_permutation": [2, 1, 0], "axis_reflections": [false, false, true]},
    {"id": "r23", "axis_permutation": [2, 1, 0], "axis_reflections": [true, true, true]}
  ],
  "provenance": {
    "/players": [{"author": "engineer", "method": "rule_ir_review", "confidence": 1.0}],
    "/tensor": [{"author": "engineer", "method": "enum_and_owner_mapping", "confidence": 1.0}],
    "/symmetries": [{"author": "engineer", "method": "proper_cube_rotation_group", "confidence": 1.0}]
  },
  "unresolved": []
}
